[{"eventoId": "falla_sensor-esp32-tanque-real-01-1793226242567", "tipo": "falla_sensor", "sensorId": "esp32-tanque-real-01", "zona": "Juliaca-A", "severidad": "advertencia", "inicioTs": 1793226242567, "finTs": 1793226262567, "valor": 5.0, "umbral": 5.0, "unidad": "lecturas", "origenLecturas": "real", "detectadoTs": 1793246358021, "versionRegla": "f4.1", "detalle": {"distanciaCm": 146.1, "nivelPct": null}}, {"eventoId": "llegada_agua-esp32-tanque-real-01-1793222084457", "tipo": "llegada_agua", "sensorId": "esp32-tanque-real-01", "zona": "Juliaca-A", "severidad": "advertencia", "inicioTs": 1793222084457, "finTs": 1793222324457, "valor": 10.517, "umbral": 6.0, "unidad": "%", "origenLecturas": "real", "detectadoTs": 1793246358021, "versionRegla": "f4.1", "detalle": {"caudalLlenadoLpm": 28.92, "fueraDeFranja": true, "franjaLima": [4, 8], "horaInicioLima": 16.25, "nivelPct": 97.4, "litros": 1071}}, {"eventoId": "falla_sensor-esp32-tanque-real-01-1793241704435", "tipo": "falla_sensor", "sensorId": "esp32-tanque-real-01", "zona": "Juliaca-A", "severidad": "advertencia", "inicioTs": 1793241704435, "finTs": 1793241724435, "valor": 5.0, "umbral": 5.0, "unidad": "lecturas", "origenLecturas": "real", "detectadoTs": 1793246358021, "versionRegla": "f4.1", "detalle": {"distanciaCm": 144.5, "nivelPct": null}}, {"eventoId": "falla_sensor-esp32-tanque-real-01-1793243719454", "tipo": "falla_sensor", "sensorId": "esp32-tanque-real-01", "zona": "Juliaca-A", "severidad": "advertencia", "inicioTs": 1793243719454, "finTs": 1793243739454, "valor": 5.0, "umbral": 5.0, "unidad": "lecturas", "origenLecturas": "real", "detectadoTs": 1793246358021, "versionRegla": "f4.1", "detalle": {"distanciaCm": -1.0, "nivelPct": null}}, {"eventoId": "llegada_agua-esp32-tanque-real-01-1793226084457", "tipo": "llegada_agua", "sensorId": "esp32-tanque-real-01", "zona": "Juliaca-A", "severidad": "advertencia", "inicioTs": 1793226084457, "finTs": 1793226129457, "valor": 10.1, "umbral": 6.0, "unidad": "%", "origenLecturas": "real", "detectadoTs": 1793246358021, "versionRegla": "f4.1", "detalle": {"caudalLlenadoLpm": 111.1, "fueraDeFranja": true, "franjaLima": [4, 8], "horaInicioLima": 17.36, "nivelPct": 97.4, "litros": 1071}}, {"eventoId": "falla_sensor-esp32-tanque-real-01-1793241799435", "tipo": "falla_sensor", "sensorId": "esp32-tanque-real-01", "zona": "Juliaca-A", "severidad": "advertencia", "inicioTs": 1793241799435, "finTs": 1793241819454, "valor": 5.0, "umbral": 5.0, "unidad": "lecturas", "origenLecturas": "real", "detectadoTs": 1793246358021, "versionRegla": "f4.1", "detalle": {"distanciaCm": -1.0, "nivelPct": null}}, {"eventoId": "falla_sensor-esp32-tanque-real-01-1793243754454", "tipo": "falla_sensor", "sensorId": "esp32-tanque-real-01", "zona": "Juliaca-A", "severidad": "advertencia", "inicioTs": 1793243754454, "finTs": 1793243774454, "valor": 5.0, "umbral": 5.0, "unidad": "lecturas", "origenLecturas": "real", "detectadoTs": 1793246358021, "versionRegla": "f4.1", "detalle": {"distanciaCm": -1.0, "nivelPct": null}}, {"eventoId": "falla_sensor-esp32-tanque-real-01-1793227276216", "tipo": "falla_sensor", "sensorId": "esp32-tanque-real-01", "zona": "Juliaca-A", "severidad": "advertencia", "inicioTs": 1793227276216, "finTs": 1793227296216, "valor": 5.0, "umbral": 5.0, "unidad": "lecturas", "origenLecturas": "real", "detectadoTs": 1793246358021, "versionRegla": "f4.1", "detalle": {"distanciaCm": 144.4, "nivelPct": null}}, {"eventoId": "falla_sensor-esp32-tanque-real-01-1793244034454", "tipo": "falla_sensor", "sensorId": "esp32-tanque-real-01", "zona": "Juliaca-A", "severidad": "advertencia", "inicioTs": 1793244034454, "finTs": 1793244054454, "valor": 5.0, "umbral": 5.0, "unidad": "lecturas", "origenLecturas": "real", "detectadoTs": 1793246358021, "versionRegla": "f4.1", "detalle": {"distanciaCm": -1.0, "nivelPct": null}}, {"eventoId": "falla_sensor-esp32-tanque-real-01-1793244129454", "tipo": "falla_sensor", "sensorId": "esp32-tanque-real-01", "zona": "Juliaca-A", "severidad": "advertencia", "inicioTs": 1793244129454, "finTs": 1793244149454, "valor": 5.0, "umbral": 5.0, "unidad": "lecturas", "origenLecturas": "real", "detectadoTs": 1793246358021, "versionRegla": "f4.1", "detalle": {"distanciaCm": -1.0, "nivelPct": null}}, {"eventoId": "falla_sensor-esp32-tanque-real-01-1793245754554", "tipo": "falla_sensor", "sensorId": "esp32-tanque-real-01", "zona": "Juliaca-A", "severidad": "advertencia", "inicioTs": 1793245754554, "finTs": 1793245774554, "valor": 5.0, "umbral": 5.0, "unidad": "lecturas", "origenLecturas": "real", "detectadoTs": 1793246358021, "versionRegla": "f4.1", "detalle": {"distanciaCm": -1.0, "nivelPct": null}}, {"eventoId": "falla_sensor-esp32-tanque-real-01-1793227982040", "tipo": "falla_sensor", "sensorId": "esp32-tanque-real-01", "zona": "Juliaca-A", "severidad": "advertencia", "inicioTs": 1793227982040, "finTs": 1793228002040, "valor": 5.0, "umbral": 5.0, "unidad": "lecturas", "origenLecturas": "real", "detectadoTs": 1793246358021, "versionRegla": "f4.1", "detalle": {"distanciaCm": 144.7, "nivelPct": null}}, {"eventoId": "falla_sensor-esp32-tanque-real-01-1793230938823", "tipo": "falla_sensor", "sensorId": "esp32-tanque-real-01", "zona": "Juliaca-A", "severidad": "advertencia", "inicioTs": 1793230938823, "finTs": 1793230958823, "valor": 5.0, "umbral": 5.0, "unidad": "lecturas", "origenLecturas": "real", "detectadoTs": 1793246358021, "versionRegla": "f4.1", "detalle": {"distanciaCm": 144.7, "nivelPct": null}}, {"eventoId": "falla_sensor-esp32-tanque-real-01-1793231068824", "tipo": "falla_sensor", "sensorId": "esp32-tanque-real-01", "zona": "Juliaca-A", "severidad": "advertencia", "inicioTs": 1793231068824, "finTs": 1793231088824, "valor": 5.0, "umbral": 5.0, "unidad": "lecturas", "origenLecturas": "real", "detectadoTs": 1793246358021, "versionRegla": "f4.1", "detalle": {"distanciaCm": 145.2, "nivelPct": null}}, {"eventoId": "falla_sensor-esp32-tanque-real-01-1793245829554", "tipo": "falla_sensor", "sensorId": "esp32-tanque-real-01", "zona": "Juliaca-A", "severidad": "advertencia", "inicioTs": 1793245829554, "finTs": 1793245849554, "valor": 5.0, "umbral": 5.0, "unidad": "lecturas", "origenLecturas": "real", "detectadoTs": 1793246358021, "versionRegla": "f4.1", "detalle": {"distanciaCm": -1.0, "nivelPct": null}}, {"eventoId": "falla_sensor-esp32-tanque-real-01-1793230613824", "tipo": "falla_sensor", "sensorId": "esp32-tanque-real-01", "zona": "Juliaca-A", "severidad": "advertencia", "inicioTs": 1793230613824, "finTs": 1793230633824, "valor": 5.0, "umbral": 5.0, "unidad": "lecturas", "origenLecturas": "real", "detectadoTs": 1793246358021, "versionRegla": "f4.1", "detalle": {"distanciaCm": 144.8, "nivelPct": null}}, {"eventoId": "falla_sensor-esp32-tanque-real-01-1793222169465", "tipo": "falla_sensor", "sensorId": "esp32-tanque-real-01", "zona": "Juliaca-A", "severidad": "advertencia", "inicioTs": 1793222169465, "finTs": 1793222189465, "valor": 5.0, "umbral": 5.0, "unidad": "lecturas", "origenLecturas": "real", "detectadoTs": 1793246358021, "versionRegla": "f4.1", "detalle": {"distanciaCm": 145.0, "nivelPct": null}}, {"eventoId": "falla_sensor-esp32-tanque-real-01-1793222224465", "tipo": "falla_sensor", "sensorId": "esp32-tanque-real-01", "zona": "Juliaca-A", "severidad": "advertencia", "inicioTs": 1793222224465, "finTs": 1793222244465, "valor": 5.0, "umbral": 5.0, "unidad": "lecturas", "origenLecturas": "real", "detectadoTs": 1793246358021, "versionRegla": "f4.1", "detalle": {"distanciaCm": 145.2, "nivelPct": null}}, {"eventoId": "falla_sensor-esp32-tanque-real-01-1793220334484", "tipo": "falla_sensor", "sensorId": "esp32-tanque-real-01", "zona": "Juliaca-A", "severidad": "advertencia", "inicioTs": 1793220334484, "finTs": 1793220354484, "valor": 5.0, "umbral": 5.0, "unidad": "lecturas", "origenLecturas": "real", "detectadoTs": 1793246358021, "versionRegla": "f4.1", "detalle": {"distanciaCm": -1.0, "nivelPct": null}}, {"eventoId": "falla_sensor-esp32-tanque-real-01-1793220484465", "tipo": "falla_sensor", "sensorId": "esp32-tanque-real-01", "zona": "Juliaca-A", "severidad": "advertencia", "inicioTs": 1793220484465, "finTs": 1793220504465, "valor": 5.0, "umbral": 5.0, "unidad": "lecturas", "origenLecturas": "real", "detectadoTs": 1793246358021, "versionRegla": "f4.1", "detalle": {"distanciaCm": 145.2, "nivelPct": null}}, {"eventoId": "falla_sensor-esp32-tanque-real-01-1793245284554", "tipo": "falla_sensor", "sensorId": "esp32-tanque-real-01", "zona": "Juliaca-A", "severidad": "advertencia", "inicioTs": 1793245284554, "finTs": 1793245304554, "valor": 5.0, "umbral": 5.0, "unidad": "lecturas", "origenLecturas": "real", "detectadoTs": 1793246358021, "versionRegla": "f4.1", "detalle": {"distanciaCm": -1.0, "nivelPct": null}}, {"eventoId": "falla_sensor-esp32-tanque-real-01-1793245344554", "tipo": "falla_sensor", "sensorId": "esp32-tanque-real-01", "zona": "Juliaca-A", "severidad": "advertencia", "inicioTs": 1793245344554, "finTs": 1793245364554, "valor": 5.0, "umbral": 5.0, "unidad": "lecturas", "origenLecturas": "real", "detectadoTs": 1793246358021, "versionRegla": "f4.1", "detalle": {"distanciaCm": -1.0, "nivelPct": null}}, {"eventoId": "falla_sensor-esp32-tanque-real-01-1793245114554", "tipo": "falla_sensor", "sensorId": "esp32-tanque-real-01", "zona": "Juliaca-A", "severidad": "advertencia", "inicioTs": 1793245114554, "finTs": 1793245134554, "valor": 5.0, "umbral": 5.0, "unidad": "lecturas", "origenLecturas": "real", "detectadoTs": 1793246358021, "versionRegla": "f4.1", "detalle": {"distanciaCm": -1.0, "nivelPct": null}}, {"eventoId": "falla_sensor-esp32-tanque-real-01-1793245184554", "tipo": "falla_sensor", "sensorId": "esp32-tanque-real-01", "zona": "Juliaca-A", "severidad": "advertencia", "inicioTs": 1793245184554, "finTs": 1793245204554, "valor": 5.0, "umbral": 5.0, "unidad": "lecturas", "origenLecturas": "real", "detectadoTs": 1793246358021, "versionRegla": "f4.1", "detalle": {"distanciaCm": -1.0, "nivelPct": null}}, {"eventoId": "llegada_a